{
  "request_id": "req-123",
  "timestamp": "2024-06-01T12:00:00Z",
  "intent": "run_tooling",
  "user": {
    "id": "user-42",
    "role": "program_manager",
    "locale": "en-US"
  },
  "channel": "api",
  "message": "Schedule a deployment review and notify the team.",
  "metadata": {
    "auth": "token-xyz",
    "session": "sess-999"
  }
}
